<?xml version="1.0" encoding="UTF-8"?>
<xs:schema xmlns:xs="http://www.w3.org/2001/XMLSchema">
    <xs:element name="commands">
        <xs:complexType>
            <xs:sequence>
                <xs:element name="command" type="commandDeclaration" maxOccurs="unbounded" />
            </xs:sequence>
        </xs:complexType>
    </xs:element>

    <xs:complexType name="commandDeclaration">
        <xs:sequence>
            <xs:element name="params" type="paramsDeclaration" minOccurs="0" maxOccurs="1" />
        </xs:sequence>
        <xs:attribute name="name" type="xs:string" use="required" />
        <xs:attribute name="class" type="xs:string" use="required" />
    </xs:complexType>

    <xs:complexType name="paramsDeclaration">
        <xs:sequence>
            <xs:element name="param" type="paramDeclaration" minOccurs="1" />
        </xs:sequence>
    </xs:complexType>

    <xs:complexType name="paramDeclaration">
        <xs:attribute name="name" type="xs:string" use="required" />
        <xs:attribute name="required" type="xs:boolean" use="required" />
        <xs:attribute name="description" type="xs:string" use="required" />
    </xs:complexType>
</xs:schema>